code,country,category,title,location,description
NC,New Caledonia,Holidays,Kanak Independence Day,Nouméa,"Cultural celebrations for indigenous Kanak people."
NC,New Caledonia,Food,Poindimié Bougna, Nouméa,"Steamed banana, taro, and meat wrapped in banana leaves."
NC,New Caledonia,Traditions,Kanak Dances, Nouméa,"Traditionsal music and dance at ceremonies."
NZ,New Zealand,Holidays,Waitangi Day,Wellington,"February 6th commemorates the Treaty of Waitangi."
NZ,New Zealand,Food,Hangi,Wellington,"Māori traditional cooking underground with heated rocks."
NZ,New Zealand,Traditions,Haka,Wellington,"Traditionsal war dance performed by Māori."
NI,Nicaragua,Holidays,Independence Day,Managua,"September 15th celebrates independence from Spain."
NI,Nicaragua,Food,Gallo Pinto,Managua,"Rice and beans dish, staple in local cuisine."
NI,Nicaragua,Traditions,Palo de Mayo,Managua,"Traditionsal Maypole dance festival."
NE,Niger,Holidays,Independence Day,Niamey,"August 3rd celebrates independence from France."
NE,Niger,Food,Jollof Rice,Niamey,"Rice dish cooked with tomato sauce and spices."
NE,Niger,Traditions,Gerewol Festival,Niamey,"Courtship festival with elaborate costumes and dances."
NG,Nigeria,Holidays,Independence Day,Abuja,"October 1st celebrates independence from the UK."
NG,Nigeria,Food,Pounded Yam and Egusi Soup,Abuja,"Staple dish made from yam and melon seed soup."
NG,Nigeria,Traditions,Yoruba Masquerades,Lagos,"Cultural dances and masked performances for festivals."
NU,Niue,Holidays,Constitution Day,Alofi,"October 19th celebrates self-governance."
NU,Niue,Food,Taro,Alofi,"Root vegetable used in traditional dishes."
NU,Niue,Traditions,Uluaki Dance,Alofi,"Traditionsal Polynesian dance performed at events."
NF,Norfolk Island,Holidays,Bounty Day,Kingston,"June 8th commemorates the arrival of Pitcairn settlers."
NF,Norfolk Island,Food,Seafood Stew,Kingston,"Local seafood cooked with herbs and vegetables."
NF,Norfolk Island,Traditions,Island Folk Songs,Kingston,"Music traditions preserving heritage."
MP,Northern Mariana Islands,Holidays,Commonwealth Day,Saipan,"January 8th marks the political union with the US."
MP,Northern Mariana Islands,Food,Red Rice,Saipan,"Rice dyed with annatto, served during celebrations."
MP,Northern Mariana Islands,Traditions,Chamorro Dancing,Saipan,"Traditionsal dance with music and storytelling."
NO,Norway,Holidays,Constitution Day,Oslo,"May 17th celebrates the signing of the constitution."
NO,Norway,Food,Lutefisk,Oslo,"Dried fish treated with lye, traditional Christmas dish."
NO,Norway,Traditions,Sauna Culture,Oslo,"Nordic tradition of communal sauna bathing."
OM,Oman,Holidays,Renaissance Day,Muscat,"July 23rd marks the start of Oman's modern era."
OM,Oman,Food,Shuwa,Muscat,"Marinated lamb slow-cooked in underground pits."
OM,Oman,Traditions,Frankincense Ceremony,Muscat,"Cultural ceremony honoring incense."
PK,Pakistan,Holidays,Independence Day,Islamabad,"August 14th marks independence from British India."
PK,Pakistan,Food,Biryani,Karachi,"Spiced rice with meat, a national favorite."
PK,Pakistan,Traditions,Truck Art,Karachi,"Decorative painting of trucks as cultural expression."
PW,Palau,Holidays,Independence Day,Ngerulmud,"October 1st celebrates independence from the US."
PW,Palau,Food,Taro and Fish,Ngerulmud,"Staple dishes with local taro and seafood."
PW,Palau,Traditions,Storytelling,Ngerulmud,"Oral tradition to pass down myths and history."
PS,Palestine,Holidays,Palestinian Independence Day,Ramallah,"November 15th commemorates the declaration of independence."
PS,Palestine,Food,Maqluba,Ramallah,"Layered rice, vegetables, and meat dish."
PS,Palestine,Traditions,Dabke Dance,Ramallah,"Folk dance performed at weddings and festivals."
PA,Panama,Holidays,Independence Day,Panama City,"November 3rd celebrates separation from Colombia."
PA,Panama,Food,Sancocho,Panama City,"Chicken and vegetable stew, national dish."
PA,Panama,Traditions,Carnival,Panama City,"Annual festival with parades and music before Lent."
PG,Papua New Guinea,Holidays,Independence Day,Port Moresby,"September 16th celebrates independence from Australia."
PG,Papua New Guinea,Food,Mumu,Port Moresby,"Food cooked underground with hot stones, traditional dish."
PG,Papua New Guinea,Traditions,Trobriand Cricket,Port Moresby,"Unique cricket games combining sport and ritual."
PY,Paraguay,Holidays,Independence Day,Asunción,"May 14–15th celebrates independence from Spain."
PY,Paraguay,Food,Sopa Paraguaya,Asunción,"Cornbread with cheese and onions, traditional dish."
PY,Paraguay,Traditions,Harpa Paraguaya Music,Asunción,"Traditionsal harp music performed at events."
PE,Peru,Holidays,Inti Raymi,Cusco,"June 24th Inca festival honoring the Sun God."
PE,Peru,Food,Ceviche,Lima,"Raw fish marinated in citrus, national dish."
PE,Peru,Traditions,Andean Textile Weaving,Cusco,"Traditionsal weaving with symbolic patterns."
PH,Philippines,Holidays,Fiesta,Santo Niño de Cebu,"Annual festival celebrating the Holy Child with parades."
PH,Philippines,Food,Adobo,Manila,"Meat stew in vinegar, soy sauce, and spices."
PH,Philippines,Traditions,Bayanihan,Manila,"Community spirit tradition of helping neighbors."
PN,Pitcairn,Holidays,Founders’ Day,Pitcairn Island,"January 23rd commemorates the arrival of settlers."
PN,Pitcairn,Food,Seafood Stew,Pitcairn Island,"Local seafood prepared simply with herbs."
PN,Pitcairn,Traditions,Folk Music,Pitcairn Island,"Traditionsal songs reflecting island heritage."
PL,Poland,Holidays,Constitution Day,Warsaw,"May 3rd celebrates the adoption of the Polish constitution."
PL,Poland,Food,Pierogi,Warsaw,"Dumplings with meat, cheese, or vegetables."
PL,Poland,Traditions,Śmigus-Dyngus,Warsaw,"Easter Monday water fight tradition."
PT,Portugal,Holidays,Portugal Day,Lisbon,"June 10th commemorates national poet Luís de Camões."
PT,Portugal,Food,Bacalhau,Lisbon,"Salted cod dish, national favorite."
PT,Portugal,Traditions,Fado Music,Lisbon,"Melancholic traditional music style."
PR,Puerto Rico,Holidays,San Sebastián Festival,San Juan,"January festival with music, parades, and street parties."
PR,Puerto Rico,Food,Mofongo,San Juan,"Mashed plantains with garlic and pork, traditional dish."
PR,Puerto Rico,Traditions,Ponce Carnival,San Juan,"Colorful parade and cultural performances before Lent."
QA,Qatar,Holidays,Qatar National Day,Doha,"December 18th marks unification of Qatar."
QA,Qatar,Food,Machboos,Doha,"Spiced rice with meat or fish, traditional dish."
QA,Qatar,Traditions,Falconry,Doha,"Traditionsal hunting practice using trained falcons."
RO,Romania,Holidays,Great Union Day,Bucharest,"December 1st celebrates the unification of Romania."
RO,Romania,Food,Sarmale,Bucharest,"Cabbage rolls stuffed with meat and rice."
RO,Romania,Traditions,Martisor,Bucharest,"Spring festival with red and white threads symbolizing health."
RU,Russian Federation,Holidays,Victory Day,Moscow,"May 9th commemorates WWII victory over Nazi Germany."
RU,Russian Federation,Food,Borscht,Moscow,"Beet soup with meat and vegetables, traditional dish."
RU,Russian Federation,Traditions,Maslenitsa,Moscow,"Week-long festival celebrating the end of winter with pancakes."
RW,Rwanda,Holidays,Independence Day,Kigali,"July 1st celebrates independence from Belgium."
RW,Rwanda,Food,Isombe,Kigali,"Cassava leaves with peanut sauce."
RW,Rwanda,Traditions,Umuganura Festival,Kigali,"Harvest festival celebrating Rwandan culture."
RE,Réunion,Holidays,Bastille Day,Saint-Denis,"July 14th French national Holidays celebrated locally."
RE,Réunion,Food,Cari,Saint-Denis,"Spicy rice and meat stew, Creole dish."
RE,Réunion,Traditions,Sega Dance,Saint-Denis,"Traditionsal music and dance with African influences."
BL,Saint Barthélemy,Holidays,National Day,Gustavia,"July 14th celebration of French heritage."
BL,Saint Barthélemy,Food,Accras,Gustavia,"Fried fish cakes, popular Caribbean dish."
BL,Saint Barthélemy,Traditions,Carnival,Gustavia,"Colorful festival with music and parades."
SH,Saint Helena, Holidays,Independence Day,Jamestown,"Commemoration of local history."
SH,Saint Helena,Food, Fish Stew,Jamestown,"Traditionsal seafood dish."
SH,Saint Helena,Traditions,Folk Music,Jamestown,"Local music performed during community events."
KN,Saint Kitts and Nevis,Holidays,Independence Day,Basseterre,"September 19th celebrates independence from the UK."
KN,Saint Kitts and Nevis,Food,Goat Water,Basseterre,"Spicy goat stew, traditional dish."
KN,Saint Kitts and Nevis,Traditions,Carnival,Basseterre,"Festival with music, parades, and dancing."
LC,Saint Lucia,Holidays,Independence Day,Castries,"February 22nd celebrates independence from the UK."
LC,Saint Lucia,Food,Green Fig and Saltfish,Castries,"Mashed green bananas with salted codfish, national dish."
LC,Saint Lucia,Traditions,Jounen Kwéyòl,Castries,"Creole culture festival with music and food."
MF,Saint Martin,Holidays,Carnival,Marigot,"Pre-Lenten festival with parades and music."
MF,Saint Martin,Food,Accras,Marigot,"Fried codfish fritters, local favorite."
MF,Saint Martin,Traditions,Music Festivals,Marigot,"Annual music celebrations reflecting local culture."
PM,Saint Pierre and Miquelon,Holidays,Bastille Day,Saint-Pierre,"July 14th celebrates French heritage."
PM,Saint Pierre and Miquelon,Food,Pâté de poisson,Saint-Pierre,"Fish pâté, traditional dish."
PM,Saint Pierre and Miquelon,Traditions,Folk Dancing,Saint-Pierre,"Local dance performances preserving heritage."
VC,Saint Vincent and the Grenadines,Holidays,Independence Day,Kingstown,"October 27th celebrates independence from the UK."
VC,Saint Vincent and the Grenadines,Food,Roasted Breadfruit,Kingstown,"Staple dish, often served with fish."
VC,Saint Vincent and the Grenadines,Traditions,Carnival,Kingstown,"Festival with music, dance, and colorful costumes."
WS,Samoa,Holidays,Independence Day,Apia,"June 1st marks independence from New Zealand."
WS,Samoa,Food,Palusami,Apia,"Taro leaves with coconut cream and meat, traditional dish."
WS,Samoa,Traditions,Siva Dance,Apia,"Traditionsal dance performed at cultural events."
SM,San Marino,Holidays,Feast of Saint Marinus,San Marino,"September 3rd celebrates the founder of the republic."
SM,San Marino,Food,Torta Tre Monti,San Marino,"Layered wafer and chocolate cake, local specialty."
SM,San Marino,Traditions,Folk Festivals,San Marino,"Annual cultural festivals with music and dance."
ST,Sao Tome and Principe,Holidays,Independence Day,São Tomé,"July 12th marks independence from Portugal."
ST,Sao Tome and Principe,Food,Calulu,São Tomé,"Stew with fish, vegetables, and spices."
ST,Sao Tome and Principe,Traditions,Cultural Dance,São Tomé,"Traditionsal dances at community celebrations."
SA,Saudi Arabia,Holidays,National Day,Riyadh,"September 23rd celebrates the unification of the kingdom."
SA,Saudi Arabia,Food,Kabsa,Riyadh,"Rice dish with meat, spices, and vegetables."
SA,Saudi Arabia,Traditions,Date Harvesting,Riyadh,"Traditionsal practice of harvesting dates during festivals."
SN,Senegal,Holidays,Independence Day,Dakar,"April 4th marks independence from France."
SN,Senegal,Food,Thieboudienne,Dakar,"Rice with fish and tomato sauce, national dish."
SN,Senegal,Traditions,Griot Storytelling,Dakar,"Oral storytelling by hereditary musicians."
RS,Serbia,Holidays,Statehood Day,Belgrade,"February 15th commemorates the uprising against Ottoman rule."
RS,Serbia,Food,Cevapi,Belgrade,"Grilled minced meat sausages, traditional dish."
RS,Serbia,Traditions,Kolo Dance,Belgrade,"Traditionsal circle dance performed at celebrations."
SC,Seychelles,Holidays,Independence Day,Victoria,"June 29th celebrates independence from the UK."
SC,Seychelles,Food,Grilled Fish,Victoria,"Fresh fish grilled with local spices."
SC,Seychelles,Traditions,Moutya Dance,Victoria,"Traditionsal dance accompanied by drums."
SL,Sierra Leone,Holidays,Independence Day,Freetown,"April 27th marks independence from the UK."
SL,Sierra Leone,Food,Groundnut Stew,Freetown,"Peanut-based stew with meat and vegetables."
SL,Sierra Leone,Traditions,Krio Cultural Festivals,Freetown,"Traditionsal music, dance, and ceremonies."
SG,Singapore,Holidays,National Day,Singapore,"August 9th marks independence from Malaysia."
SG,Singapore,Food,Chilli Crab,Singapore,"Spicy crab dish, popular local specialty."
SG,Singapore,Traditions,Lunar New Year,Singapore,"Traditionsal celebrations with lion dances and rituals."
SX,Sint Maarten (Dutch part),Holidays,Sint Maarten,Philipsburg,"November 11th celebrates the island's cultural heritage with parades and music."
SX,Sint Maarten (Dutch part),Food,Johnny Cake,Philipsburg,"Traditionsal baked bread often served with meat or fish."
SX,Sint Maarten (Dutch part),Traditions,Caribbean Carnival,Philipsburg,"Annual festival with colorful costumes, music, and dancing."
SK,Slovakia,Holidays,Slovak Constitution,Bratislava,"September 1st marks the adoption of the Slovak constitution."
SK,Slovakia,Food,Bryndzové Halušky,Bratislava,"Potato dumplings with sheep cheese, national dish."
SK,Slovakia,Traditions,Folk Music and Dance,Bratislava,"Traditionsal dances and songs performed during festivals."
SI,Slovenia,Holidays,Statehood,Ljubljana,"June 25th celebrates Slovenia's independence from Yugoslavia."
SI,Slovenia,Food,Potica,Ljubljana,"Rolled nut cake served during Holidays and celebrations."
SI,Slovenia,Traditions,Slovenian Folk Dancing,Ljubljana,"Traditionsal dances with regional costumes performed at festivals."
SB,Solomon Islands,Holidays,Independence,Honiara,"July 7th marks independence from the UK with parades and cultural displays."
SB,Solomon Islands,Food,Poisson Cru,Honiara,"Raw fish salad marinated in coconut milk and lime juice, traditional dish."
SB,Solomon Islands,Traditions,Trobriand-Style Dancing,Honiara,"Ceremonial dances performed at festivals and community events."
SO,Somalia,Holidays,Independence,Mogadishu,"July 1st celebrates independence from Italy and the UK with parades and ceremonies."
SO,Somalia,Food,Sambusa,Mogadishu,"Fried pastry filled with meat or vegetables, popular snack."
SO,Somalia,Traditions,Henna Ceremonies,Mogadishu,"Body decoration with intricate designs for weddings and celebrations."
ZA,South Africa,Holidays,Freedom,Pretoria,"April 27th commemorates the end of apartheid and celebrates democracy."
ZA,South Africa,Food,Bobotie,Cape Town,"Spiced minced meat baked with an egg-based topping, traditional dish."
ZA,South Africa,Traditions,Ubuntu,Pretoria,"Cultural philosophy emphasizing community, sharing, and human dignity."
GS,South Georgia and the South Sandwich Islands,Holidays,Discovery,Grytviken,"Commemorates historic discovery and exploration of the islands."
GS,South Georgia and the South Sandwich Islands,Food,Seafood Stew,Grytviken,"Local seafood prepared with simple ingredients."
GS,South Georgia and the South Sandwich Islands,Traditions,Seal Hunting Heritage,Grytviken,"Historical traditions related to sealing and exploration."
SS,South Sudan,Holidays,Independence,Juba,"July 9th celebrates independence from Sudan with national events."
SS,South Sudan,Food,Kisra,Juba,"Fermented flatbread made from sorghum, staple food."
SS,South Sudan,Traditions,Dinka Cattle Festival,Juba,"Ceremonial events involving cattle, dancing, and cultural rites."
ES,Spain,Holidays,La Tomatina,Buñol,"Annual tomato-throwing festival held in August."
ES,Spain,Food,Paella,Valencia,"Rice dish with saffron, seafood, and meats, traditional Spanish dish."
ES,Spain,Traditions,Flamenco,Dance,"Andalusian music and dance with expressive movements and guitar."
LK,Sri Lanka,Holidays,Esala Perahera,Kandy,"Buddhist festival featuring processions with decorated elephants and dancers."
LK,Sri Lanka,Food,Kottu Roti,Colombo,"Chopped flatbread stir-fried with vegetables, eggs, and meat."
LK,Sri Lanka,Traditions,Kandyan Dance,Kandy,"Traditionsal dance performed during cultural and religious festivals."
SD,Sudan,Holidays,Independence,Khartoum,"January 1st celebrates independence from joint British-Egyptian rule."
SD,Sudan,Food,Asida,Khartoum,"Stiff porridge made from wheat or sorghum, eaten with sauces."
SD,Sudan,Traditions,Nubian Weddings,Khartoum,"Colorful ceremonies with music, dancing, and traditional attire."
SR,Suriname,Holidays,Independence,Paramaribo,"November 25th marks independence from the Netherlands."
SR,Suriname,Food,Roti,Paramaribo,"Flatbread served with curried vegetables, chicken, or meat."
SR,Suriname,Traditions,Maroon Festivals,Paramaribo,"Cultural celebrations with music and dance from Maroon communities."
SJ,Svalbard and Jan Mayen,Holidays,Polar Night,Svalbard,"Period of continuous darkness in winter with cultural events."
SJ,Svalbard and Jan Mayen,Food,Seal Meat,Longyearbyen,"Traditionsal meat consumed historically by settlers."
SJ,Svalbard and Jan Mayen,Traditions,Dog Sledding,Longyearbyen,"Traditionsal activity used for transportation and cultural heritage."
SZ,Swaziland,Holidays,Umhlanga (Reed Dance),Lobamba,"Annual ceremony honoring young women and cultural traditions."
SZ,Swaziland,Food,Sishwala,Lobamba,"Traditionsal Swazi porridge made from maize meal."
SZ,Swaziland,Traditions,Incwala Ceremony,Lobamba,"Kingship ceremony celebrating harvest and national unity."
SE,Sweden,Holidays,Midsummer,Stockholm,"June celebration with maypoles, songs, and traditional dancing."
SE,Sweden,Food,Smörgåsbord,Stockholm,"Buffet of hot and cold Swedish dishes, often for celebrations."
SE,Sweden,Traditions,Lucia Festival,Stockholm,"December festival honoring Saint Lucia with candles and songs."
CH,Switzerland,Holidays,Swiss National Day,Bern,"August 1st celebrates Switzerland's founding with fireworks and parades."
CH,Switzerland,Food,Chocolate,Bern,"World-renowned Swiss chocolate, part of culinary heritage."
CH,Switzerland,Traditions,Yodeling,Bern,"Traditionsal singing style in alpine regions."
SY,Syrian Arab Republic,Holidays,Independence,Damascus,"April 17th celebrates independence from France."
SY,Syrian Arab Republic,Food,Kibbeh,Damascus,"Minced meat with bulgur and spices, traditional dish."
SY,Syrian Arab Republic,Traditions,Dabke Dance,Damascus,"Folk line dance performed at weddings and festivals."
TW,Taiwan,Province of China,Holidays,Lunar New Year,Taipei,"Major Holidays celebrated with family reunions and traditional rituals."
TW,Taiwan,Province of China,Food,Beef Noodle Soup,Taipei,"Braised beef with noodles, national comfort dish."
TW,Taiwan,Province of China,Traditions,Dragon Boat Festival,Taipei,"Race of decorated boats with traditional ceremonies."
TJ,Tajikistan,Holidays,Navruz,Dushanbe,"March 21st Persian New Year celebration with traditional music, food, and festivities."
TJ,Tajikistan,Food,Plov,Dushanbe,"Rice dish with meat, carrots, and spices, national favorite."
TJ,Tajikistan,Traditions,Pamir Festivals,Dushanbe,"Cultural festivals showcasing music, dance, and local customs in Pamir region."
TZ,Tanzania,United Republic of,Holidays,Union Day,Dodoma,"April 26th celebrates the union of Tanganyika and Zanzibar."
TZ,Tanzania,United Republic of,Food,Ugali,Dodoma,"Cornmeal porridge staple eaten with sauces and stews."
TZ,Tanzania,United Republic of,Traditions,Maasai Ceremonies,Arusha,"Rites of passage and cultural dances of the Maasai people."
TH,Thailand,Holidays,Songkran,Bangkok,"April water festival marking Thai New Year with splashing water and celebrations."
TH,Thailand,Food,Pad Thai,Bangkok,"Stir-fried rice noodles with tamarind, shrimp, peanuts, and eggs."
TH,Thailand,Traditions,Khon Dance,Bangkok,"Traditionsal masked dance depicting stories from the Ramakien."
TL,Timor-Leste,Holidays,Independence Day,Dili,"May 20th celebrates independence from Indonesia with parades and cultural events."
TL,Timor-Leste,Food,Ikan Pepes,Dili,"Fish wrapped in banana leaves with spices, traditional dish."
TL,Timor-Leste,Traditions,Tais Weaving,Dili,"Traditionsal handwoven textiles with symbolic patterns."
TG,Togo,Holidays,Independence Day,Lomé,"April 27th marks independence from France with national festivities."
TG,Togo,Food,Fufu,Lomé,"Starchy dough made from cassava or yams, eaten with sauces."
TG,Togo,Traditions,Agbadza Dance,Lomé,"Ewe ethnic group dance performed at celebrations."
TK,Tokelau,Holidays,National Day,Nukunonu,"Celebrates local culture and traditions of the atoll communities."
TK,Tokelau,Food,Coconut Fish,Nukunonu,"Local fish dishes prepared with coconut milk."
TK,Tokelau,Traditions,Fale Building,Nukunonu,"Traditionsal construction of community houses using local materials."
TO,Tonga,Holidays,King's Birthday,Nukuʻalofa,"Celebration of the monarch's birthday with ceremonies and performances."
TO,Tonga,Food,Ota ika,Nukuʻalofa,"Raw fish marinated in coconut milk and citrus, traditional dish."
TO,Tonga,Traditions,Tongan Dance,Nukuʻalofa,"Cultural dance performed during ceremonies and festivals."
TT,Trinidad and Tobago,Holidays,Carnival,Port of Spain,"Pre-Lenten festival with parades, costumes, and music."
TT,Trinidad and Tobago,Food,Callaloo,Port of Spain,"Leafy green soup with okra, coconut milk, and spices."
TT,Trinidad and Tobago,Traditions,Soca Music,Port of Spain,"Popular music genre performed during Carnival and celebrations."
TN,Tunisia,Holidays,Independence Day,Tunis,"March 20th marks independence from France."
TN,Tunisia,Food,Couscous,Tunis,"Steamed semolina dish with vegetables or meat, traditional cuisine."
TN,Tunisia,Traditions,Malouf Music,Tunis,"Classical Andalusian music preserved in cultural events."
TR,Turkey,Holidays,Republic Day,Ankara,"October 29th celebrates the proclamation of the Turkish Republic."
TR,Turkey,Food,Kebabs,Ankara,"Grilled meat dishes, widely recognized in Turkish cuisine."
TR,Turkey,Traditions,Whirling Dervishes,Konya,"Sufi dance and meditation ritual symbolizing spiritual ascent."
TM,Turkmenistan,Holidays,Independence Day,Ashgabat,"October 27th celebrates independence from the Soviet Union."
TM,Turkmenistan,Food,Plov,Ashgabat,"Rice dish with meat and carrots, traditional Turkmen meal."
TM,Turkmenistan,Traditions,Niyazov Festivals,Ashgabat,"Cultural celebrations honoring national heritage and leaders."
TC,Turks and Caicos Islands,Holidays,National Holidays,Providenciales,"Celebrates local culture and heritage with festivities."
TC,Turks and Caicos Islands,Food,Conch Salad,Providenciales,"Fresh conch mixed with vegetables and citrus, local dish."
TC,Turks and Caicos Islands,Traditions,Folk Music,Providenciales,"Traditionsal music performed at community events."
TV,Tuvalu,Holidays,Independence Day,Funafuti,"October 1st celebrates independence from the UK."
TV,Tuvalu,Food,Pulaka,Funafuti,"Taro root grown in swamp pits, staple food."
TV,Tuvalu,Traditions,Fatele Dance,Funafuti,"Traditionsal group dance performed at ceremonies."
UG,Uganda,Holidays,Independence Day,Kampala,"October 9th celebrates independence from Britain."
UG,Uganda,Food,Matoke,Kampala,"Steamed and mashed green bananas, staple dish."
UG,Uganda,Traditions,Bakiga Traditionsal Dance,Kampala,"Cultural dance performed during celebrations and community events."
UA,Ukraine,Holidays,Independence Day,Kyiv,"August 24th celebrates independence from the Soviet Union with parades and festivities."
UA,Ukraine,Food,Borscht,Kyiv,"Beet soup with meat and vegetables, traditional national dish."
UA,Ukraine,Traditions,Pysanka,Kyiv,"Decorative Easter eggs created with wax-resist method, cultural symbol."
AE,United Arab Emirates,Holidays,National Day,Abu Dhabi,"December 2nd marks the union of the emirates."
AE,United Arab Emirates,Food,Al Harees,Abu Dhabi,"Slow-cooked wheat and meat dish, traditional Emirati meal."
AE,United Arab Emirates,Traditions,Falconry,Abu Dhabi,"Ancient hunting practice with trained falcons."
GB,United Kingdom,Holidays,Trooping the Colour,London,"June event celebrating the monarch’s birthday with ceremonial parade."
GB,United Kingdom,Food,Fish and Chips,London,"Fried fish with potato fries, iconic British dish."
GB,United Kingdom,Traditions,Highland Games,Scotland,"Scottish athletic and cultural competitions with music and dance."
US,United States,Holidays,Independence Day,Washington D.C.,"July 4th celebrates independence from Britain with fireworks and parades."
US,United States,Food,Hamburger,New York,"Grilled meat patty in a bun, iconic American food."
US,United States,Traditions,Thanksgiving,Washington D.C.,"Annual harvest celebration with family meals and traditions."
UM,United States Minor Outlying Islands,Holidays,Flag Day,Wake Island,"Observance celebrating the US flag and island territories."
UM,United States Minor Outlying Islands,Food,Local Seafood,Wake Island,"Fresh seafood dishes sourced from surrounding waters."
UM,United States Minor Outlying Islands,Traditions,Island Ceremonies,Wake Island,"Cultural and ceremonial events held by island communities."
UY,Uruguay,Holidays,Independence Day,Montevideo,"August 25th celebrates independence from Brazil."
UY,Uruguay,Food,Asado,Montevideo,"Barbecue meats cooked over an open fire, national favorite."
UY,Uruguay,Traditions,Candombe,Montevideo,"African-influenced drumming and dance performed at festivals."
UZ,Uzbekistan,Holidays,Independence Day,Tashkent,"September 1st celebrates independence from the Soviet Union."
UZ,Uzbekistan,Food,Plov,Tashkent,"Rice dish with carrots, meat, and spices, traditional cuisine."
UZ,Uzbekistan,Traditions,Navruz Celebration,Tashkent,"Spring festival marking Persian New Year with food, music, and rituals."
VU,Vanuatu,Holidays,Independence Day,Port Vila,"July 30th celebrates independence from France and Britain."
VU,Vanuatu,Food,Lap Lap,Port Vila,"Grated root vegetables baked with coconut cream and meat."
VU,Vanuatu,Traditions,Custom Dance,Port Vila,"Traditionsal dances performed during ceremonies and festivals."
VE,Venezuela,Holidays,Independence Day,Caracas,"July 5th marks independence from Spain."
VE,Venezuela,Food,Arepas,Caracas,"Cornmeal cakes filled with meat, cheese, or beans, national dish."
VE,Venezuela,Traditions,Joropo Dance,Caracas,"Traditionsal music and dance representing Venezuelan culture."
