code,country,category,title,location,description
VN,Viet Nam,Holidays,Tet Festival,Hanoi,"Lunar New Year festival with family gatherings, rituals, and fireworks."
VN,Viet Nam,Food,Phở,Hanoi,"Rice noodle soup with beef or chicken, iconic Vietnamese dish."
VN,Viet Nam,Traditions,Ao Dai Wearing,Hanoi,"Traditionsal long dress worn during festivals and formal occasions."
VG,Virgin Islands, British,Holidays,Emancipation Day,Road Town,"August 1st commemorates the abolition of slavery."
VG,Virgin Islands, British,Food,Conch Fritters,Road Town,"Fried conch balls, local Caribbean dish."
VG,Virgin Islands, British,Traditions,Folk Music,Road Town,"Traditionsal music performed at community events and celebrations."
VI,Virgin Islands, U.S.,Holidays,Transfer Day,Charlotte Amalie,"March 31st commemorates US purchase of the islands from Denmark."
VI,Virgin Islands, U.S.,Food,Johnny Cake,Charlotte Amalie,"Cornmeal flatbread, traditional local dish."
VI,Virgin Islands, U.S.,Traditions,Carnival,Charlotte Amalie,"Annual festival with parades, music, and cultural performances."
WF,Wallis and Futuna,Holidays,National Day,Mata-Utu,"Celebrates local culture and French heritage."
WF,Wallis and Futuna,Food,Breadfruit and Fish,Mata-Utu,"Staple food in local cuisine, prepared in traditional ways."
WF,Wallis and Futuna,Traditions,Kava Ceremony,Mata-Utu,"Cultural ritual using kava beverage for social and ceremonial events."
EH,Western Sahara,Holidays,National Day,El Aaiún,"February 27th commemorates the founding of the Sahrawi Arab Democratic Republic."
EH,Western Sahara,Food,Camel Meat Stew,El Aaiún,"Traditionsal dish of stewed camel meat with spices."
EH,Western Sahara,Traditions,Sahrawi Poetry,El Aaiún,"Oral poetry recited to preserve heritage and stories."
YE,Yemen,Holidays,Revolution Day,Sanaa,"September 26th celebrates the start of the revolution."
YE,Yemen,Food,Saltah,Sanaa,"Spiced meat and vegetable stew with fenugreek and vegetables."
YE,Yemen,Traditions,Al-Baida Dance,Sanaa,"Traditionsal Yemeni dance performed at festivals and celebrations."
ZM,Zambia,Holidays,Independence Day,Lusaka,"October 24th marks independence from Britain."
ZM,Zambia,Food,Nshima,Lusaka,"Maize porridge staple eaten with vegetables or meat."
ZM,Zambia,Traditions,Kuomboka Ceremony,Lusaka,"Annual Lozi festival marking the movement of the king's palace to higher ground."
ZW,Zimbabwe,Holidays,Independence Day,Harare,"April 18th celebrates independence from the UK."
ZW,Zimbabwe,Food,Sadza,Harare,"Cornmeal porridge, staple dish served with vegetables or meat."
ZW,Zimbabwe,Traditions,Mbira Music,Harare,"Traditionsal music using thumb piano at cultural and religious events."
AX,Åland Islands,Holidays,Åland Islands Autonomy Day,Mariehamn,"June 9th celebrates local autonomy within Finland."
AX,Åland Islands,Food,Åland Pancakes,Mariehamn,"Sweet pancakes often served with berries and cream."
AX,Åland Islands,Traditions,Folk Music,Mariehamn,"Traditionsal songs and dances performed during festivals."
AF,Afghanistan,Customs,Hospitality,Kabul,"Welcoming guests with tea and food is an important social customs."
AL,Albania,Customs,Besa Code,Tirana,"Customs of keeping promises and offering protection to guests."
DZ,Algeria,Customs,Hammam Etiquette,Algiers,"Visiting the public bath with respect for privacy and rituals."
AS,American Samoa,Customs,Kava Ceremony,Tutuila,"Sharing kava in a communal setting to welcome guests."
AD,Andorra,Customs,Festa Major,Andorra la Vella,"Community festivals celebrating patron saints with local customs."
AO,Angola,Customs,Social Greeting,Luanda,"Handshakes and inquiries about family are part of social etiquette."
AI,Anguilla,Customs,Community Feasts,The Valley,"Neighbors gather to share food and celebrate together."
AQ,Antarctica,Customs,Researcher Gatherings,McMurdo Station,"Informal social customs among scientists for bonding."
AG,Antigua and Barbuda,Customs,Independence Parades,St. John's,"Communities participate in parades and local celebrations."
AR,Argentina,Customs,Mate Sharing,Buenos Aires,"Passing around the mate cup in social gatherings is customary."
AM,Armenia,Customs,Carpet Greeting,Yerevan,"Guests are welcomed with gestures involving traditional carpets."
AW,Aruba,Customs,Bon Bini Greeting,Oranjestad,"Visitors are formally welcomed with music and dance."
AU,Australia,Customs,Acknowledgment of Country,Canberra,"Paying respect to Indigenous lands before events."
AT,Austria,Customs,Advent Calendar,Salzburg,"Opening calendar windows daily during December leading to Christmas."
AZ,Azerbaijan,Customs,Novruz Sprinkling,Baku,"Sprinkling water on each other as a sign of good luck for the new year."
BS,Bahamas,Customs,Junkanoo Preparation,Nassau,"Communities collaborate in making costumes before festivals."
BH,Bahrain,Customs,Majlis Meetings,Manama,"Men host gatherings to discuss community and family matters."
BD,Bangladesh,Customs,Pahela Baishakh, Dhaka,"Celebrating the new year with visits to relatives and exchanging sweets."
BB,Barbados,Customs,Crop Over Preparation,Bridgetown,"Community groups practice dances and music before the festival."
BY,Belarus,Customs,Koliada Carols,Minsk,"Visiting homes to sing songs and give blessings during Holidayss."
BE,Belgium,Customs,Baking Waffles,Brussels,"Sharing homemade waffles during community events."
BZ,Belize,Customs,Garifuna Drumming,Belmopan,"Drumming sessions to bring the community together."
BJ,Benin,Customs,Vodun Offerings,Porto-Novo,"Offering gifts to spirits during communal ceremonies."
BM,Bermuda,Customs,Emancipation Processions,Hamilton,"Community processions to commemorate historical freedom."
BT,Bhutan,Customs,Offering Khada,Thimphu,"Presenting ceremonial scarves as a sign of respect."
BO,Bolivia,Customs,Carnaval Preparation,La Paz,"Communities prepare costumes and dances for carnival parades."
BQ,Bonaire, Sint Eustatius and Saba,Customs,Dia di Rincon Parade,Kralendijk,"Local residents participate in processions and cultural activities."
BA,Bosnia and Herzegovina,Customs,Sevdah Music Gatherings,Sarajevo,"Communities gather to sing and play traditional songs."
BW,Botswana,Customs,Boitsho Community Meals,Gaborone,"Sharing meals during community events strengthens social bonds."
BR,Brazil,Customs,Carnival Costume Making,Rio de Janeiro,"Groups collaboratively create costumes for Carnival celebrations."
IO,British Indian Ocean Territory,Customs,Community Potlucks,Diego Garcia,"Residents organize meals to share food and socialize."
BN,Brunei Darussalam,Customs,Majlis Hospitality,Bandar Seri Begawan,"Hosting guests in formal gatherings with tea and snacks."
BG,Bulgaria,Customs,Kukeri Ritual Preparation,Dobrich,"Villagers prepare masks and costumes together for ceremonies."
BF,Burkina Faso,Customs,Yaar Festival Offerings,Ouagadougou,"Communities offer gifts to ancestors collectively."
BI,Burundi,Customs,Drum Circle Participation,Gitega,"Residents join in drumming to celebrate important events."
KH,Cambodia,Customs,Khmer New Year Games,Phnom Penh,"Families and neighbors participate in traditional games together."
CM,Cameroon,Customs,Ngondo Offerings,Douala,"Community offerings made to river spirits for blessings."
CA,Canada,Customs,First Nations Smudging,Ottawa,"Burning sacred herbs for purification before events."
CV,Cape Verde,Customs,Tabanka Dancing,Santiago,"Residents participate in dancing parades to celebrate heritage."
KY,Cayman Islands,Customs,Pirate Festival Participation,George Town,"Local residents actively join the festival with costumes and performances."
CF,Central African Republic,Customs,Zar Ceremony Attendance,Bangui,"Community members take part in healing ceremonies."
TD,Chad,Customs,Sara Mask Dance Participation,N'Djamena,"Communities join masked dances during festivals."
CL,Chile,Customs,Fiestas Patrias Participation,Santiago,"Neighbors gather to celebrate independence with traditional customs."
CN,China,Customs,Dragon Boat Racing,Beijing,"Communities organize boat races during the Dragon Boat Festival."
CX,Christmas Island,Customs,Crab Watching,Flying Fish Cove,"Locals and visitors observe the annual migration together."
CC,Cocos (Keeling) Islands,Customs,Weaving Workshops,West Island,"Residents practice traditional weaving in community gatherings."
CO,Colombia,Customs,Cumbia Dancing,Bogotá,"Community members join in traditional dance events."
KM,Comoros,Customs,Chakacha Dance Participation,Moroni,"Villagers participate in coastal dance ceremonies."
CG,Congo,Customs,Tinga Tinga Art Sharing,Kinshasa,"Artists share folk art and storytelling in communal settings."
CD,Congo, the Democratic Republic of the,Customs,Ngoma Participation,Kinshasa,"Community members engage in drum dancing during ceremonies."
CK,Cook Islands,Customs,Ori Dance Participation,Avarua,"Villagers actively participate in traditional dances."
CR,Costa Rica,Customs,Tope Nacional Participation,San José,"Community members join in horse parades showcasing culture."
HR,Croatia,Customs,Kukeri Parade Participation,Fužine,"Locals participate in masked dance processions."
CU,Cuba,Customs,Parrandas Participation,Remedios,"Residents engage in festive street celebrations."
CW,Curaçao,Customs,Carnival Participation,Willemstad,"Community members take part in parades with music and costumes."
CY,Cyprus,Customs,Karagiozis Puppet Shows,Nicosia,"Villagers and children attend shadow puppet performances."
CZ,Czech Republic,Customs,Masopust Participation,Prague,"Community members participate in carnival processions."
CI,Côte d'Ivoire,Customs,Mask Dance Participation,Abidjan,"Residents join in ceremonial dances using masks."
DK,Denmark,Customs,Fastelavn Participation,Copenhagen,"Community involvement in traditional carnival games and costumes."
DJ,Djibouti,Customs,Mask Dance Participation,Djibouti,"Locals join in masked dance rituals during festivals."
DM,Dominica,Customs,Calypso Festival Participation,Roseau,"Community members actively engage in music competitions."
DO,Dominican Republic,Customs,Merengue Festival Participation,Santo Domingo,"Villagers participate in traditional music and dance events."
EC,Ecuador,Customs,Inti Raymi Participation,Quito,"Community involvement in the Sun Festival with music and offerings."
EG,Egypt,Customs,Nubian Hospitality,Cairo,"Guests are welcomed with tea, sweets, and storytelling."
SV,El Salvador,Customs,Feria Participation,San Salvador,"Residents actively join local fairs with games and food."
GQ,Equatorial Guinea,Customs,Benga Dance Participation,Malabo,"Villagers participate in traditional dances during celebrations."
ER,Eritrea,Customs,Coffee Ceremony,Asmara,"Communities gather to perform ceremonial coffee preparation and drinking."
EE,Estonia,Customs,Seto Leelo Singing,Võru,"Residents participate in traditional polyphonic singing events."
ET,Ethiopia,Customs,Timkat Procession,Addis Ababa,"Communities take part in Epiphany celebrations with rituals and processions."
FK,Falkland Islands (Malvinas),Customs,Sheep Shearing Festival,Stanley,"Local communities gather for sheep shearing events and socializing."
FO,Faroe Islands,Customs,Ólavsøka Participation,Tórshavn,"Villagers join in national celebrations with boat races and dancing."
FJ,Fiji,Customs,Yaqona Ceremony,Nadi,"Communities perform traditional kava rituals together for visitors."
FI,Finland,Customs,Midsummer Bonfires Participation,Helsinki,"Residents participate in lighting bonfires to celebrate the summer solstice."
FR,France,Customs,Galette des Rois Sharing,Paris,"Communities share a cake with a hidden charm during Epiphany."
GF,French Guiana,Customs,Carnival Participation,Cayenne,"Locals actively join the parades and costume celebrations."
PF,French Polynesia,Customs,Heiva I Tahiti Participation,Papeete,"Villagers engage in traditional dance competitions and performances."
TF,French Southern Territories,Customs,Researcher Gatherings,Kerguelen,"Scientific teams follow informal communal gatherings for morale."
GA,Gabon,Customs,Iyema Dance Participation,Libreville,"Communities participate in traditional dance ceremonies."
GM,Gambia,Customs,Kankurang Ritual,Banjul,"Locals join masked dances for protection and community blessings."
GE,Georgia,Customs,Tamada Toasting,Tbilisi,"Community members participate in ceremonial toasts during feasts."
DE,Germany,Customs,Oktoberfest Participation,Munich,"Villagers join beer festivals with music, dancing, and traditional costumes."
GH,Ghana,Customs,Homowo Festival Participation,Accra,"Community engagement in harvesting festival activities and feasts."
GI,Gibraltar,Customs,Moorish Castle Festival,Gibraltar,"Residents participate in historical reenactments and parades."
GR,Greece,Customs,Karagiozis Puppet Shows,Athens,"Villagers attend and perform traditional shadow puppet storytelling."
GL,Greenland,Customs,Kalaaliaraq Participation,Nuuk,"Community involvement in local sports and cultural competitions."
GD,Grenada,Customs,Spicemas Participation,St. George's,"Residents join parades and dances during Carnival celebrations."
GP,Guadeloupe,Customs,Carnival Participation,Basse-Terre,"Community members actively engage in music and costume parades."
GU,Guam,Customs,Chamorro Feast Participation,Hagatna,"Villagers gather to prepare and share traditional foods during festivals."
GT,Guatemala,Customs,Semana Santa Processions,Antigua,"Communities participate in religious processions with carpets of sawdust."
GG,Guernsey,Customs,Island Games Participation,St Peter Port,"Local residents engage in traditional sporting events and community activities."
GN,Guinea,Customs,Festival of Masks Participation,Conakry,"Communities join masked dances to honor ancestors."
GW,Guinea-Bissau,Customs,Traditionsal Drumming,Bissau,"Villagers participate in drumming circles during local events."
GY,Guyana,Customs,Mashramani Participation,Georgetown,"Community involvement in national celebrations with music and dance."
HT,Haiti,Customs,Rara Festival Participation,Port-au-Prince,"Residents join street processions with music, drums, and costumes."
VA,Holy See (Vatican City State),Customs,Papal Audience Attendance,Vatican City,"Visitors and locals participate in ceremonial gatherings with the Pope."
HN,Honduras,Customs,La Ceiba Carnival Participation,La Ceiba,"Communities engage in parades, music, and dances during carnival."
HK,Hong Kong,Customs,Cheung Chau Bun Festival Participation,Cheung Chau,"Locals participate in climbing bun towers and parades."
HU,Hungary,Customs,Busójárás Participation,Mohač,"Villagers join masked festivals to scare away winter spirits."
IS,Iceland,Customs,Þorrablót Participation,Reykjavík,"Communities gather to celebrate midwinter with traditional foods and songs."
IN,India,Customs,Diwali Festivities Participation,Delhi,"Neighborhoods come together to light lamps, share sweets, and celebrate."
ID,Indonesia,Customs,Nyepi Observance,Bali,"Communities collectively observe a day of silence, fasting, and meditation."
IR,Iran,Customs,Nowruz Haft-Seen Preparation,Tehran,"Residents participate in preparing symbolic items for the new year festival."
IQ,Iraq,Customs,Kurdish Newroz Participation,Erbil,"Communities gather to celebrate the Kurdish new year with dancing and bonfires."
IE,Ireland,Customs,St. Brigid's Cross Making,Dublin,"Villagers make crosses from reeds to celebrate St. Brigid's feast."
IM,Isle of Man,Customs,Hop-tu-Naa Participation,Peel,"Communities engage in traditional Halloween celebrations with songs and games."
IL,Israel,Customs,Shuk Market Interaction,Tel Aviv,"Locals participate in market bargaining and communal shopping customs."
IT,Italy,Customs,La Befana Visits,Rome,"Communities celebrate the Epiphany with a witch-like figure distributing sweets."
JM,Jamaica,Customs,Jonkonnu Parade Participation,Kingston,"Residents join masked parades with music during Christmas."
JP,Japan,Customs,Hanami Picnics,Tokyo,"Communities gather under cherry blossoms to enjoy food and celebrate spring."
JE,Jersey,Customs,La Fête dé Noué Participation,St Helier,"Residents engage in Christmas-time customs including parades and music."
JO,Jordan,Customs,Bedouin Hospitality,Amman,"Guests are welcomed with tea, coffee, and shared meals in traditional tents."
KZ,Kazakhstan,Customs,Nowruz Spring Festival Participation,Astana,"Communities celebrate with horse games, music, and dancing."





